<?xml version="1.0" encoding="UTF-8"?>
<!DOCTYPE lliga SYSTEM "lliga.dtd">
<lliga>
    <equip>
        <nomEquip>Barcelona</nomEquip>
        <partit>League</partit>
        <ubicacio>Campnou</ubicacio>
        <director>Joan LaPorta</director>
        <preparadors>
            <preparador>Hansi Flick</preparador>
            <preparador>preparador2</preparador>            
        </preparadors>
        <resultats>
            <victories>14</victories>
            <derrotes>5</derrotes>          
        </resultats>      
        <jugadors>
            <jugador>
                <nomJugador>Lamine</nomJugador>
                <cognom>Yamal</cognom>
                <dataNaixement>13 de julio del 2007</dataNaixement>
                <funcions>
                    <principal>delantero</principal>
                    <secundaries>
                        <secundaria>extremo derecho</secundaria>
                        <secundaria>media punta</secundaria>
                    </secundaries>
                </funcions>
            </jugador>
            <jugador>
                <nomJugador>Pablo</nomJugador>
                <cognom>Páez Gavira</cognom>
                <dataNaixement>5 de agosto de 2004</dataNaixement>
                <funcions>
                    <principal>centrocampista</principal>
                    <secundaries>
                        <secundaria>Mediocentro</secundaria>
                        <secundaria>Extremo izquierdo</secundaria>
                    </secundaries>
                </funcions>
            </jugador>
        </jugadors>
    </equip>
    <equip>
        <nomEquip>Real Madrid</nomEquip>
        <partit>League</partit>
        <ubicacio>Santiago Bernabeu</ubicacio>
        <director>Florentino Perez</director>
        <preparadors>
            <preparador>Carlo Ancelotti</preparador>        
            <preparador>preparador2</preparador>     
        </preparadors>
        <resultats>
            <victories>15</victories>
            <derrotes>3</derrotes>           
        </resultats>     
        <jugadors>
            <jugador>
                <nomJugador>Rodrygo</nomJugador>
                <cognom>Goes</cognom>
                <dataNaixement>9 de enero del 2001</dataNaixement>
                <funcions>
                    <principal>delantero</principal>
                    <secundaries>
                        <secundaria>delantero centro</secundaria>
                        <secundaria>extremo derecho</secundaria>
                        <secundaria>extremo izquierdo</secundaria>
                    </secundaries>
                </funcions>
            </jugador>
                        <jugador>
                <nomJugador>Kylian</nomJugador>
                <cognom>Mbappé</cognom>
                <dataNaixement>20 de diciembre de 1998</dataNaixement>
                <funcions>
                    <principal>delantero</principal>
                    <secundaries>
                        <secundaria>delantero centro</secundaria>
                    </secundaries>
                </funcions>
            </jugador>
            
        </jugadors>
    </equip>
</lliga>